{
  "$schema": "https://json-schema.org/draft/2020-12/schema",
  "$id": "https://github.com/seo-skills/geo-audit-skill/blob/main/src/geo_audit/assets/envelope.schema.json",
  "title": "SEOmator GEO Audit Skill envelope",
  "description": "Every command emits this shape. `additionalProperties: false` at the top level is the freeze: a new key is a deliberate edit to this file and a schema_version decision, not an accident. Additive changes inside the nested objects do not bump schema_version; removing or renaming a top-level key does, and is announced two releases ahead.",
  "type": "object",
  "required": [
    "schema_version",
    "command",
    "ok",
    "cli_version",
    "scoring_version",
    "data_version",
    "normalizer_version",
    "run_id",
    "observed_at",
    "evidence",
    "completeness",
    "scores",
    "signals",
    "findings",
    "error"
  ],
  "additionalProperties": false,
  "properties": {
    "schema_version": { "type": "integer", "const": 1 },
    "command": {
      "type": "string",
      "enum": ["fetch", "crawl", "audit", "compare", "score", "validate", "llmstxt", "scan", "report", "prune", "doctor"]
    },
    "ok": {
      "type": "boolean",
      "description": "Whether the command produced a valid result. NOT a verdict on the site: a 403 from an audited page is ok: true with a critical finding."
    },
    "cli_version": { "type": "string" },
    "scoring_version": { "type": "string" },
    "data_version": { "type": "string" },
    "normalizer_version": { "type": "integer" },
    "run_id": { "type": "string", "pattern": "^[0-9A-HJKMNP-TV-Z]{26}$" },
    "observed_at": { "type": "string", "pattern": "^\\d{4}-\\d{2}-\\d{2}T\\d{2}:\\d{2}:\\d{2}Z$" },

    "evidence": {
      "type": ["object", "null"],
      "properties": {
        "stamp": { "type": "string", "enum": ["CURRENT", "PARTIAL", "STALE"] },
        "content_hash": { "type": ["string", "null"] },
        "normalizer_version": { "type": "integer" },
        "pages_ok": { "type": "integer", "minimum": 0 },
        "pages_failed": {
          "type": "array",
          "items": {
            "type": "object",
            "required": ["url", "reason"],
            "properties": {
              "url": { "type": "string" },
              "reason": { "type": "string" },
              "status": { "type": ["integer", "null"] }
            }
          }
        }
      }
    },

    "completeness": {
      "type": ["object", "null"],
      "properties": {
        "computed": { "type": "integer", "minimum": 0 },
        "total": { "type": "integer", "minimum": 0 },
        "missing": { "type": "array", "items": { "type": "string" } },
        "categories": { "type": "object" }
      }
    },

    "scores": {
      "type": ["object", "null"],
      "description": "Null when nothing was scorable. Never a zero standing in for an absence.",
      "properties": {
        "composite": { "type": ["integer", "null"], "minimum": 0, "maximum": 100 },
        "tier": { "type": "string" },
        "tier_meaning": { "type": "string" },
        "categories": {
          "type": "object",
          "additionalProperties": { "type": "integer", "minimum": 0, "maximum": 100 }
        }
      }
    },

    "signals": {
      "type": "array",
      "items": {
        "type": "object",
        "required": ["id", "class", "value", "max", "detail"],
        "properties": {
          "id": { "type": "string" },
          "class": { "type": "string", "enum": ["deterministic", "heuristic", "live", "advisory"] },
          "value": {
            "type": ["number", "null"],
            "description": "Null means not measured. It never means zero."
          },
          "max": { "type": "number", "minimum": 0 },
          "page": { "type": ["string", "null"] },
          "detail": { "type": "object" },
          "skipped_reason": { "type": "string" }
        }
      }
    },

    "findings": {
      "type": "array",
      "items": {
        "type": "object",
        "required": ["id", "severity", "effort", "priority", "title", "remediation", "pages"],
        "properties": {
          "id": { "type": "string" },
          "severity": { "type": "string", "enum": ["critical", "high", "medium", "low"] },
          "effort": { "type": "string", "enum": ["low", "medium", "high"] },
          "priority": { "type": "integer", "minimum": 1 },
          "points_lost": { "type": "number", "minimum": 0 },
          "pages": { "type": "array", "items": { "type": "string" } },
          "title": { "type": "string" },
          "remediation": { "type": "string" },
          "excerpt": { "type": ["string", "null"], "maxLength": 280 }
        }
      }
    },

    "error": {
      "type": ["object", "null"],
      "required": ["code", "message", "hint", "docs", "log"],
      "properties": {
        "code": { "type": "string", "pattern": "^GEO_E_[A-Z_]+$" },
        "message": { "type": "string" },
        "hint": { "type": "string", "minLength": 1 },
        "docs": { "type": ["string", "null"] },
        "log": { "type": "string" }
      }
    },

    "page": { "type": "object", "description": "fetch, score, validate" },
    "crawl": { "type": "object", "description": "crawl, audit" },
    "compare": { "type": "object", "description": "compare" },
    "schema": { "type": ["object", "null"], "description": "validate" },
    "llmstxt": { "type": "object", "description": "llmstxt" },
    "scan": { "type": "object", "description": "scan, and audit with --brand" },
    "report": { "type": "object", "description": "report" },
    "prune": { "type": "object", "description": "prune" },
    "checks": { "type": "array", "description": "doctor" },
    "rescore": { "type": "object", "description": "audit --rescore" },
    "note": { "type": "string", "description": "a state sentence, when one applies" },
    "site": { "type": "string" },
    "url": { "type": "string" }
  }
}
