{
  "cli_version": "1.2.1",
  "command": "compare",
  "compare": {
    "categories": {
      "citability": {
        "after": 70,
        "before": 70,
        "delta": 0
      },
      "content": {
        "after": 36,
        "before": 36,
        "delta": 0
      },
      "platform": {
        "after": 16,
        "before": 16,
        "delta": 0
      },
      "schema": {
        "after": 24,
        "before": 24,
        "delta": 0
      },
      "technical": {
        "after": 82,
        "before": 82,
        "delta": 0
      }
    },
    "composite_delta": 0,
    "findings": {
      "introduced": [],
      "introduced_titles": [],
      "persisting": [
        "citability.answer_first",
        "citability.attribution",
        "citability.evidence_density",
        "citability.extractability",
        "citability.self_containment",
        "citability.structure",
        "content.depth",
        "content.expertise",
        "content.freshness",
        "content.readability",
        "fetch.not_found",
        "platform.feeds",
        "platform.llms_txt",
        "platform.social_cards",
        "schema.article",
        "schema.breadth",
        "schema.organization",
        "schema.presence",
        "schema.validity",
        "technical.status_health",
        "technical.transport_security"
      ],
      "resolved": [],
      "resolved_titles": []
    },
    "from": {
      "composite": 51,
      "observed_at": "<volatile>",
      "pages_ok": 7,
      "run_id": "<volatile>",
      "tier": "weak"
    },
    "pages": {
      "added": [],
      "changed": [],
      "removed": [],
      "unchanged": 8
    },
    "signals": [],
    "tier_changed": false,
    "to": {
      "composite": 51,
      "observed_at": "<volatile>",
      "pages_ok": 7,
      "run_id": "<volatile>",
      "tier": "weak"
    },
    "versions": {
      "from": {
        "data_version": "2026.09",
        "normalizer_version": 3,
        "scoring_version": "4.0"
      },
      "to": {
        "data_version": "2026.09",
        "normalizer_version": 3,
        "scoring_version": "4.0"
      }
    }
  },
  "completeness": null,
  "data_version": "2026.09",
  "error": null,
  "evidence": {
    "content_hash": "e4a38ad112fe6b5b2d75d9ef8cb07a9b134c566988fb905008880fcd967c856c",
    "normalizer_version": 3,
    "pages_failed": [
      {
        "reason": "not_found",
        "status": 404,
        "url": "http://fixture/gone"
      },
      {
        "reason": "not_html",
        "status": null,
        "url": "http://fixture/not-html"
      }
    ],
    "pages_ok": 7,
    "stamp": "PARTIAL"
  },
  "findings": [],
  "normalizer_version": 3,
  "observed_at": "<volatile>",
  "ok": true,
  "run_id": "<volatile>",
  "schema_version": 1,
  "scores": {
    "categories": {
      "citability": 70,
      "content": 36,
      "platform": 16,
      "schema": 24,
      "technical": 82
    },
    "composite": 51,
    "tier": "weak",
    "tier_meaning": "Answers exist on these pages but are buried in context that does not travel."
  },
  "scoring_version": "4.0",
  "signals": [],
  "site": "127.0.0.1",
  "url": "http://fixture/hub.html"
}
