{
  "cli_version": "1.2.1",
  "command": "report",
  "completeness": {
    "categories": {
      "computed": [
        "citability",
        "content",
        "platform",
        "schema",
        "technical"
      ],
      "declared": [
        "citability",
        "content",
        "platform",
        "schema",
        "technical"
      ],
      "missing": [],
      "weights_used": {
        "citability": 25,
        "content": 20,
        "platform": 10,
        "schema": 10,
        "technical": 15
      }
    },
    "computed": 24,
    "missing": [
      "citability.render_parity",
      "platform.hreflang"
    ],
    "total": 26
  },
  "data_version": "2026.09",
  "error": null,
  "evidence": {
    "content_hash": "e4a38ad112fe6b5b2d75d9ef8cb07a9b134c566988fb905008880fcd967c856c",
    "normalizer_version": 3,
    "pages_failed": [
      {
        "reason": "not_found",
        "status": 404,
        "url": "http://fixture/gone"
      },
      {
        "reason": "not_html",
        "status": null,
        "url": "http://fixture/not-html"
      }
    ],
    "pages_ok": 7,
    "stamp": "PARTIAL"
  },
  "findings": [],
  "normalizer_version": 3,
  "observed_at": "<volatile>",
  "ok": true,
  "report": {
    "advisory_answered": [],
    "brand": {
      "attribution": true,
      "customised": false,
      "name": null,
      "source": null,
      "warnings": []
    },
    "bytes": 72382,
    "from_run": "<volatile>",
    "mode": "client",
    "observed_at": "<volatile>",
    "path": "<volatile>",
    "pdf_path": null,
    "pdf_skipped": null,
    "site": "127.0.0.1",
    "site_kind": null,
    "strengths": [
      "technical.crawler_access",
      "technical.url_structure"
    ]
  },
  "run_id": "<volatile>",
  "schema_version": 1,
  "scores": {
    "categories": {
      "citability": 70,
      "content": 36,
      "platform": 16,
      "schema": 24,
      "technical": 82
    },
    "composite": 51,
    "tier": "weak",
    "tier_meaning": "Answers exist on these pages but are buried in context that does not travel."
  },
  "scoring_version": "4.0",
  "signals": []
}
