{
  "cli_version": "1.2.1",
  "command": "prune",
  "completeness": null,
  "data_version": "2026.09",
  "error": null,
  "evidence": null,
  "findings": [],
  "normalizer_version": 3,
  "observed_at": "<volatile>",
  "ok": true,
  "prune": {
    "applied": false,
    "bytes_reclaimed": "<volatile>",
    "home": "<volatile>",
    "limits": {
      "keep_days": 365,
      "keep_runs": 1,
      "max_page_bytes": 104857600,
      "max_project_bytes": 10485760,
      "page_grace_hours": 24
    },
    "projects": [
      {
        "bytes_after": "<volatile>",
        "bytes_before": "<volatile>",
        "damaged_lines_discarded": 0,
        "dropped_by": {},
        "oldest_kept": "<volatile>",
        "page_bytes_kept": "<volatile>",
        "page_bytes_reclaimed": "<volatile>",
        "pages_deleted": 0,
        "project": "127-0-0-1",
        "runs_before": 1,
        "runs_dropped": 0,
        "runs_kept": 1,
        "skipped": false
      }
    ],
    "runs_dropped": 0
  },
  "run_id": "<volatile>",
  "schema_version": 1,
  "scores": null,
  "scoring_version": "4.0",
  "signals": []
}
