{
  "cli_version": "1.2.1",
  "command": "crawl",
  "completeness": null,
  "crawl": {
    "disallowed_by_robots": [
      "http://fixture/private/secret.html"
    ],
    "discovered": 7,
    "elapsed_ms": "<volatile>",
    "limits": {
      "concurrency": 5,
      "max_pages": 8,
      "requests_per_second": 50.0,
      "robots_respected": true,
      "sitemap_used": true,
      "timeout": 30.0
    },
    "pages": [
      {
        "blocks": 1,
        "content_chars": 11,
        "content_hash": "5bfd9356eaa44105570432b163e1715218cd1b1f8864ec7aefad0433588d9687",
        "content_root": "body",
        "headings": 0,
        "jsonld_types": [],
        "scorable": true,
        "status": 200,
        "url": "http://fixture/csr-shell.html"
      },
      {
        "blocks": 0,
        "content_chars": 0,
        "content_hash": null,
        "content_root": null,
        "headings": 0,
        "jsonld_types": [],
        "scorable": false,
        "status": 404,
        "url": "http://fixture/gone"
      },
      {
        "blocks": 21,
        "content_chars": 679,
        "content_hash": "717811f3cb5b2665d3e2ba5adf2483e37e87fd118132ecfe4b86452dc3a56eb7",
        "content_root": "main",
        "headings": 4,
        "jsonld_types": [],
        "scorable": true,
        "status": 200,
        "url": "http://fixture/hub.html"
      },
      {
        "blocks": 8,
        "content_chars": 824,
        "content_hash": "e5db5b8ca8829bdfc01e8f8a1221fbb3af69eae6f204b76c6a46e5e2f7bb9238",
        "content_root": "main",
        "headings": 3,
        "jsonld_types": [],
        "scorable": true,
        "status": 200,
        "url": "http://fixture/injection.html"
      },
      {
        "blocks": 11,
        "content_chars": 944,
        "content_hash": "0e7c7f0b5560db3b7813455af74c8042d2cb26c0156017d4b5088abd4bd99267",
        "content_root": "body",
        "headings": 5,
        "jsonld_types": [],
        "scorable": true,
        "status": 200,
        "url": "http://fixture/listing.html"
      },
      {
        "blocks": 9,
        "content_chars": 703,
        "content_hash": "0660ee45adb182d59c58442b2ee7a201b4c67afea4fde7611cda1b4e685b6d36",
        "content_root": "main",
        "headings": 4,
        "jsonld_types": [],
        "scorable": true,
        "status": 200,
        "url": "http://fixture/schema-broken.html"
      },
      {
        "blocks": 9,
        "content_chars": 705,
        "content_hash": "608a79d1ddb44c4f7fbfc9bd527709f56c61282035271a6e1e9289d53ceb1b40",
        "content_root": "main",
        "headings": 4,
        "jsonld_types": [],
        "scorable": true,
        "status": 200,
        "url": "http://fixture/schema-none.html"
      },
      {
        "blocks": 28,
        "content_chars": 2052,
        "content_hash": "21b637b7478f9846af832eed141dbdd39a6ef8681dfed68cc5a7716a7a910b43",
        "content_root": "main",
        "headings": 5,
        "jsonld_types": [
          "Article"
        ],
        "scorable": true,
        "status": 200,
        "url": "http://fixture/ssr-rich.html"
      }
    ],
    "pages_crawled": 8,
    "pages_ok": 7,
    "robots": {
      "access": [
        {
          "agent": "GPTBot",
          "allowed": false,
          "crawl_delay": null
        },
        {
          "agent": "OAI-SearchBot",
          "allowed": true,
          "crawl_delay": null
        },
        {
          "agent": "ChatGPT-User",
          "allowed": true,
          "crawl_delay": null
        },
        {
          "agent": "PerplexityBot",
          "allowed": true,
          "crawl_delay": null
        },
        {
          "agent": "Perplexity-User",
          "allowed": true,
          "crawl_delay": null
        },
        {
          "agent": "ClaudeBot",
          "allowed": true,
          "crawl_delay": null
        },
        {
          "agent": "Claude-SearchBot",
          "allowed": true,
          "crawl_delay": null
        },
        {
          "agent": "Claude-User",
          "allowed": true,
          "crawl_delay": null
        },
        {
          "agent": "Google-Extended",
          "allowed": true,
          "crawl_delay": null
        },
        {
          "agent": "Googlebot",
          "allowed": true,
          "crawl_delay": null
        },
        {
          "agent": "Bingbot",
          "allowed": true,
          "crawl_delay": null
        },
        {
          "agent": "Applebot",
          "allowed": true,
          "crawl_delay": null
        },
        {
          "agent": "Applebot-Extended",
          "allowed": true,
          "crawl_delay": null
        },
        {
          "agent": "meta-externalagent",
          "allowed": true,
          "crawl_delay": null
        },
        {
          "agent": "Amazonbot",
          "allowed": true,
          "crawl_delay": null
        },
        {
          "agent": "CCBot",
          "allowed": true,
          "crawl_delay": null
        }
      ],
      "self_allowed": true,
      "sitemaps": [
        "http://fixture/sitemap.xml"
      ],
      "source_url": "http://fixture/robots.txt",
      "status": 200,
      "unavailable": false,
      "unreachable": false
    },
    "seeded_from_sitemap": 2,
    "site": "127.0.0.1",
    "start_url": "http://fixture/hub.html",
    "stopped_because": "max_pages"
  },
  "data_version": "2026.09",
  "error": null,
  "evidence": {
    "content_hash": "e4a38ad112fe6b5b2d75d9ef8cb07a9b134c566988fb905008880fcd967c856c",
    "normalizer_version": 3,
    "pages_failed": [
      {
        "reason": "not_found",
        "status": 404,
        "url": "http://fixture/gone"
      },
      {
        "reason": "not_html",
        "status": null,
        "url": "http://fixture/not-html"
      }
    ],
    "pages_ok": 7,
    "stamp": "PARTIAL"
  },
  "findings": [
    {
      "effort": "low",
      "excerpt": "HTTP 404",
      "id": "fetch.not_found",
      "impact": null,
      "page_level": false,
      "pages": [
        "http://fixture/gone"
      ],
      "points_lost": 0.0,
      "priority": 1,
      "remediation": "Fix the link or remove it. A crawler that follows it spends part of its budget on a 404, and an engine that followed it from a citation sends the reader nowhere.",
      "severity": "high",
      "title": "A link points at a page that does not exist"
    }
  ],
  "normalizer_version": 3,
  "observed_at": "<volatile>",
  "ok": true,
  "run_id": "<volatile>",
  "schema_version": 1,
  "scores": null,
  "scoring_version": "4.0",
  "signals": []
}
